{
  "name": "eos",
  "displayName": "EOS",
  "aliases": ["eos-mainnet"],
  "caip2ChainId": "antelope:aca376f206b8fc25a6ed44dbdc66547c",
  "blockExplorerUrls": [
    "https://bloks.io/"
  ],
  "publicRpcUrls": [
    "https://eos.api.eosnation.io/"
  ],
  "publicApiUrls": [],
  "isTestnet": false,
  "studioSupport": [],
  "issuanceRewards": false,
  "nativeToken": "EOS",
  "docsUrl": "https://docs.eosnetwork.com/docs/latest/quick-start/introduction",
  "web3Icon": "eos",
  "genesisBlock": {
    "hash": "0000000267f3e2284b482f3afc2e724be1d6cbc1804532ec62d4e7af47c30693",
    "height": 2
  },
  "firehoseBlock": {
    "type": "sf.antelope.type.v1.Block",
    "bufBuildUrl": "https://buf.build/pinax/firehose-antelope",
    "bytesEncoding": "hex"
  }
}
